<?xml version="1.0" encoding="UTF-8"?>
<domainInputs name="shoppingCart" version="0.1" xmlns="http://www.fbk.eu/xinput"
	xmlns:xsi="http://www.w3.org/2001/XMLSchema-instance"
	xsi:schemaLocation="http://www.fbk.eu/xinput ../xsd/xinput.xsd ">
	
	<xinput id="add_input" events="add">
		<atomicParam id="itemid" name="itemid">
			<dataClz base="string" name="itemid">
				<enumeration value="hat001"/>
				<enumeration value="dog001"/>
				<enumeration value="sou001"/>
				<enumeration value="cha001"/>
				<enumeration value="str001"/>
				<enumeration value="qua001"/>
			</dataClz> 
		</atomicParam>
	</xinput>
	
	<xinput id="remove_input" events="rem">
		<atomicParamRef paramRef="itemid" />
	</xinput>

	<xinput id="add_remove" events="add rem">
		<atomicParamRef paramRef="itemid" />
	</xinput>
	
	<xinput id="empty_input" events="empty"/>
	
	<xinput id="book_input" events="none">
		<compositeParam id="bookdata">
			<atomicParam id="title">
				<dataClz base="string" name="fulltitle">
					<minLength value="3"/>
					<maxLength value="1024"/>
				</dataClz>
			</atomicParam>
			<atomicParam id="price"> 
				<dataClz base="double" name="expensive">
					<minInclusive value="10.0"/>
				</dataClz>
				<dataClz base="double" name="cheap">
					<minInclusive value="0.0"/>
					<maxExclusive value="10.0"/>
				</dataClz>
			</atomicParam>
			<atomicParam id="date"> 
				<dataClz base="string" name="date">
					<pattern value="^(0[1-9]|1[012])[- /.](0[1-9]|[12][0-9]|3[01])[- /.](19|20)\d\d$"/>
				</dataClz>
			</atomicParam>
		</compositeParam>
		<atomicParamRef paramRef="itemid" />
	</xinput>
	
	<event id="add" name="add" webType="button" webEventToFire="onclick" reachedBy="//button[@id='btnAdd']"/>
	<event id="rem" name="remove" webType="button" webEventToFire="onclick" reachedBy="//button[@id='btnRemove']"/>
	<event id="empty" name="empty" webType="button" webEventToFire="onclick" reachedBy="//button[@id='btnEmpty']"/>
	
</domainInputs>
